{
  "key": "_3ThZQZeZro|ja|zh-Hans",
  "videoId": "_3ThZQZeZro",
  "src": "ja",
  "tgt": "zh-Hans",
  "model": "deepseek-v4-flash",
  "cues": [
    {
      "s": 680,
      "d": 10680,
      "o": "はいバヤシブルです今回は今話題の マジスクのレビューをしていこうと思い ますライブ中に教えていただいたんですよ",
      "t": "大家好，这里是巴亚希布鲁。这次我打算评测一下最近热门的话题产品——魔技锉。"
    },
    {
      "s": 9040,
      "d": 26679,
      "o": "配所はなんか静岡ホビー賞ですごいの なんか面白いの出てるっていうんでそれで 教えてもらってその後Twitter見て たらちょうどなんかアルゴファイルさんの その公式Twitterが回ってきて なんか売行いいですみたいなのが回ってき ててAmazon見に行ったら売り切れて てその後淀橋見に行ったらまだ予約受付中 だったので私はヨドバで購入してみました",
      "t": "听说在静冈模型展上出了个很厉害、很有趣的东西，于是有人告诉了我。之后我上推特一看，正好看到阿古路文件公司的官方推特在转发，说卖得不错。我去亚马逊一看已经卖光了，后来去淀桥发现还在接受预订，所以我在淀桥下单买了一个。"
    },
    {
      "s": 33559,
      "d": 29561,
      "o": "あとこれなんですけどジルコニア セラミックは強い衝撃によりかけることが ありますのでってあるんですけどあの キャップないんすよねなのでキャップは つけてもらいたかったこれこれが1番です ねま今回の動画の中でキャップが欲しかっ た以上ですでちょっとねえっと使って いこうかと思います",
      "t": "另外就是这个，上面写着“氧化锆陶瓷可能因强烈冲击而碎裂”，但居然没有盖子。所以我希望它能配上盖子。这真是第一重要的啊。总之，这次视频里我最想要的就是盖子。那么，接下来我会试着用一下。"
    },
    {
      "s": 60440,
      "d": 5120,
      "o": "で何をやろうかって言うとこのジム",
      "t": "说到要做什么，我本来想喷涂这个吉姆·斯巴达，也做了些加工，但嫌麻烦就做得比较偷懒。就是这样，之前削掉了分模线，但有些地方没削干净，于是我用这把魔技锉试着打磨了一下，非常容易操作。"
    },
    {
      "s": 63120,
      "d": 10359,
      "o": "スパルタンも塗装しようと思って色々 ちょこっととね加工はしてやったんです けどめんどくさくて結構手抜きだったん",
      "t": "至于这些细小的刻线，如果用笔刀的话会卡住划伤，但用这把魔技锉就不会，削得很顺。请看中间那个，应该就很好理解了。"
    },
    {
      "s": 70320,
      "d": 11520,
      "o": "ですけどこんな感じでパーテーション ラインを消してはいたんですけどあまり 消しきれてなかった部分をちょっとこの",
      "t": "现在我正在打磨右边那个，之前也处理得半吊子。但用了这把魔技锉后，怎么说呢，它能不破坏刻线，细腻又轻松地打磨，感觉就像能做平面处理一样。"
    },
    {
      "s": 78720,
      "d": 7480,
      "o": "マジスクで削ってみたんですけど非常に",
      "t": "嗯，非常好用。"
    },
    {
      "s": 81840,
      "d": 19160,
      "o": "やりやすいですこの細かいモールドまあね そのデザインナイフだと引っかかって傷が 入ったりするですけどこのマジスクだと そんなこともなくかなりいい感じで削って くれますえ真ん中のやつを見ていただける",
      "t": "总之就是好用，这个真不错。不过这次我只用了这个，或者说还没怎么用呢。但对于像高等级模型那种一体成型的零件和部件来说，我觉得会非常好用。现在我把零件拆下来看看，从这里开始。就像刚才说的，对于这种一体成型的部位，一边做平面处理一边处理这些缝隙，非常容易操作。"
    },
    {
      "s": 97560,
      "d": 16640,
      "o": "と分かりやすいと思いますで今これが右端 のやつをやっているんですけどこれ もちょっと中途半端だったんですけどこの マジスク使うと非常にこのなんて言えば",
      "t": "而且如果用笔刀的话，那个缝隙和这个较大的面会出现划痕……哎呀怎么说呢，就是容易有划痕。虽然你可以说是我技术不行，但魔技锉就能轻松咔咔处理，作为一个平面来说非常好。然后这里是普通的平面处理，真的就像撕下一层薄皮一样，轻轻刮一下就行。"
    },
    {
      "s": 110159,
      "d": 17430,
      "o": "いいんだろうモールドを潰すこともなくえ 細やかにえ簡単に削ることができるかこ 面出しができるみたいな感じになるんだと 思いますうん非常にいいですとにかくいい",
      "t": "这个也非常容易操作，完全没有卡住的感觉，目前用起来非常顺滑。对于习惯用笔刀的人来说……现在不好详细说，但有过那样的场景。不过大家请放心，完全不用担心会切到手指，虽然还是要小心一点。就这样，这种边缘或者说边角的小平面处理也非常容易。"
    },
    {
      "s": 127599,
      "d": 10000,
      "o": "ですこりゃいいうーんま今回これしかま これしかというかまだあまり使ってないの",
      "t": "我其实很不擅长这种小平面处理，总是会让边角变圆。但用魔技锉的话相对容易多了。虽然不能说它很厉害，毕竟也有我技术的问题，但确实能够保留边角的同时进行平面处理。嗯，用笔刀或者干脆放弃的时候，边角往往会被压坏，但这次算是保留得比较好。"
    },
    {
      "s": 134440,
      "d": 8079,
      "o": "であれなんですけどハイグレードみたいに その一体化してしまっているものとか",
      "t": "这也和刚才一样，总之这种地方很容易处理，非常好用。它不会留下台阶，这一点最棒了。"
    },
    {
      "s": 140239,
      "d": 12201,
      "o": "パーツとかに関しては非常にいいんじゃ ないのかなと思ってい ますでちょっと今ねふんどし外してみて",
      "t": "还有像这样的小平面处理也是可能的，和刚才腰部的导弹舱一样。另外这里，也是我做得很随意、技术不行的地方，但像这种低质边缘的残留部分，它也能一下子削掉，非常好用。出乎意料的是，那种低质边缘有时会残留，需要再打磨，但用这个就很轻松，嗯，干净利落地消失了，很容易。"
    },
    {
      "s": 149280,
      "d": 24959,
      "o": "ここからなんですけどこういった先ほども 言ったこのパーツ一体化してしまっている ところこういう平面出しをしながら のこういう隙間これが非常にやりやすい ですしかもこれデザインナイフでやると その隙間とえっとこの大きい面がちょっと",
      "t": "稍微这里有点问题，我正在做的是将零件分开。对于高等级模型那种一体成型的零件，有时候想把它分件。我用魔技锉试了一下，但关于这个，我觉得还是用普通锉刀比较好。说起来有点难操作，这种刻意去做的话，还是用普通锉刀更好。"
    },
    {
      "s": 171640,
      "d": 23120,
      "o": "なんて言うんすかね筋が入ってしまったり まそれお前の義量がないんだと言われたら それまでなんですけど入りやすかったり するんでですけど非常にそのペッてペッて できます1面として非常にいいですでここ は普通の面出しになりますま本当薄皮を",
      "t": "接下来是水口处理。包装上也有写，说是也可以处理水口，所以我试了一下剪钳留下的残留。让魔技锉稍微平躺，削掉后，再这样平面处理应该就能处理好了。关于这一点，我觉得比笔刀好。用笔刀有时会挖深，但魔技锉相对较少出现这种情况。"
    },
    {
      "s": 192159,
      "d": 19601,
      "o": "めくるみたいな感じになりますかけになり ますこれはこれも非常にやりやすいです なんか引っかかったりすることも特にない です今の ところサクサクサクサク行く感じになり",
      "t": "最后还是要用砂纸打磨，这没办法。但我觉得做得挺漂亮的。对于经常用笔刀导致挖深的人来说，这个可能挺不错的。"
    },
    {
      "s": 208159,
      "d": 24231,
      "o": "ますデインナイフでやり慣れている方に 関してもん今ちょっとねあのこ細かいこと は言えないんですけどうんっていうシーン があったんですけどま皆さんもね全くえ なんか指が切れる切れないみたいなことも ないまちょっとねちょっとという感じなん ですけど気をつけてくださいでこんな感じ で",
      "t": "虽然也有笔刀太锋利的问题，但和刚才一样，处理很简单。另外包装上写的刻线，我也贴了引导胶带试了一下，但关于这一点，我想有很多人是笔刀派，笔刀绝对更好。这种刻意调整角度的刻线……嗯，感觉不太好说。"
    },
    {
      "s": 232400,
      "d": 29519,
      "o": "えっとふのこのエッジエッジというか角と 言いますかこの小さい面出しも非常にやり やすいです私はこの小さい面出し非常に 苦手でエッジが緩くなってしまってうん 苦手なんですけどこのマジスクだと比較的 やりやすかったですすごいとはちょっとね 私の義量の問題もあって言えないんです",
      "t": "嗯，解释起来有点难。那么，我觉得还是笔刀绝对更好，或者普通锉刀更好。我用笔刀划线时有时会用刀背，但刀背特别不好用。嗯，所以还是普通锉刀好。"
    },
    {
      "s": 257519,
      "d": 14761,
      "o": "けど比較的エッジを残しながら面出しが 可能でし たうんデザインナイフだったりあとその",
      "t": "至于刻线，对于无刻线部分不好说，但那个也还是笔刀更好。不过处理完后的去毛刺非常好用，很简单，这点可以推荐。"
    },
    {
      "s": 267919,
      "d": 22601,
      "o": "もう諦めてヤりがけし大体んエッジが潰れ てしまうんですけど今回は結構残った方だ と思いますでまこれも先ほどと同じことな んですけどとにかくこういうところはやり やすいです非常にいいですこれ段差ができ ないのがとにかくいいですあとこういう",
      "t": "包装上也写了去毛刺，我觉得非常好。就这样简单用了一下魔技锉，感觉非常好，我很喜欢。"
    },
    {
      "s": 287479,
      "d": 25881,
      "o": "小さい面出しも可能です先ほどのあの腰に ついたミサイルポットと同じなんですけど あとここなんですけどこれも私が適当に やった義量がないというとこなんですけど バダエッジの削り底根ダリナみたいな ところもあっという間に削り取ってくれ ます非常にいいです案外バダエッジがね",
      "t": "如果能再看我一支视频我会很高兴，拜托了。也请关注频道，那么拜拜。"
    },
    {
      "s": 309720,
      "d": 23199,
      "o": "なんかやるてると残っちゃったりもっと 削らなきゃいけなかったりなんていう シーンがあるんですけど非常にいい ですうん綺麗に消えました簡単 にちょっとここはあれなんですよねえ何を",
      "t": "嗯，就是这样，这次关于魔技锉的使用感受就到这里。我真的很喜欢，感觉质量不错。"
    },
    {
      "s": 330800,
      "d": 29560,
      "o": "やってるかというと別パーツ化になります ハイグレードだとまこういう一体整形の もの別パーツ化したいという時なんです けどでそれをマジスクでやってみたんです がこれに関しては普通にタを使った方が いいと思いますやりづらいと言いますか このあえてやってるうんうんこれは普にタ 使った方がいいと思いますでゲート処理に",
      "t": "虽然没有完全预料到，但实际用下来确实很好。大家如果感兴趣可以试试看。"
    },
    {
      "s": 358520,
      "d": 24679,
      "o": "なりますこれはあのパッケージにも書いて あったんでゲート処理も可能ですよという ことだったのでまちょっとランナーの 切り残しをちょっとやってみましたま比較 的マジスクを寝かせてえ削り取ってからま こんな感じで面出しすると処理ができるの かなと思い ますまこれに関してはデザインナイフより",
      "t": "另外，包装说明里也提到了，这种锉刀可以对塑料进行精细加工，我觉得很适合模型制作。"
    },
    {
      "s": 381479,
      "d": 23720,
      "o": "はいいと思いますデザインナイフだと えぐってしまう場合あるんですけどこれ マジスクだと比較的そういったシが少ない のかなって思いましたでま最終的にこの やすりがけしなきゃいけないのはしょうが ないと思うんです がま非常に綺麗にできたかなと思います よくあのデザインナイフ使ってしまうと",
      "t": "对于经常使用笔刀的人来说可能会有点不习惯，但一旦适应了就会觉得很顺手。"
    },
    {
      "s": 403319,
      "d": 17681,
      "o": "うんえぐっちゃうよっていう人には ちょっといいかなと思いましたデザイン ナイフが切れすぎっていうの問題もあるん です けどま先ほどと同じで処理は簡単ですで",
      "t": "特别是对于消除合模线和水口，效果非常棒，比想象中更省力。"
    },
    {
      "s": 418479,
      "d": 31280,
      "o": "あとパッケージ書いてあった筋彫りなん ですけどこれ もちょまガイドテープを貼ってやってみて はいるんですけどこれに関してはとにかく デザインナイフ派の方もいっぱいいると 思うんですけどデザインナイフの方が絶対 いいですこのあえてやってやる角度がうん これに関しては何ともて感じになってい ましたうん説明はちょっと難しいんです",
      "t": "当然，有些细节还是需要笔刀来完成，但作为辅助工具，魔技锉表现很优秀。"
    },
    {
      "s": 447520,
      "d": 25239,
      "o": "けどうん だったらこれはデザインナイフの方が絶対 いいと思いますし普通にタがいいと思い ます私デザインナイフでガっていく時は ちょっと裏の刃を使ったりするんですけど 裏の裏の刃は特に使いづらかった ですうんこんな普通にタがいいと思います",
      "t": "总的来说，这次体验让我很满意，我会继续使用它。希望大家也喜欢。"
    },
    {
      "s": 469080,
      "d": 25200,
      "o": "筋彫りに関しては掘りなしに関しては何と も言えませんがまそれに関してもやっぱ デザインナイフの方がいいでしょうねで やった後のこのバリ取りに関しては非常に いいです簡単ですそこはお勧めできますま バリとりも書いてあったんでパッケージに 非常にいいと思い ますまこんな感じでちょっとマジスク簡単",
      "t": "最后，再次感谢大家观看。如果觉得有用，请点赞和订阅。我们下期再见。"
    },
    {
      "s": 491919,
      "d": 20560,
      "o": "に使ってみたんですけど非常に良かった です私は好きですもう1本動画見て もらえると嬉しいのでよろしくお願い いたしますチャンネル登録もよろしくお 願いいたしますではバイバイ ですDET",
      "t": "谢谢，拜拜。"
    }
  ],
  "createdAt": 1783794154921
}