{
  "key": "DzJm1pk_GVA|ja|zh-Hans",
  "videoId": "DzJm1pk_GVA",
  "src": "ja",
  "tgt": "zh-Hans",
  "model": "deepseek-v4-flash",
  "cues": [
    {
      "s": 9800,
      "d": 14319,
      "o": "はい、どうもGMOです。今回は前回のね 、MGバルバトルブス全動画に続いて今回 はミキシング編となります。今回はね、ま",
      "t": "大家好，我是GMO。这次接着上次的MG巴巴托斯狼王全涂装视频，是混合编。这次呢，"
    },
    {
      "s": 21800,
      "d": 11120,
      "o": "、せっかくということでね、動画を分けて ストレートな全塗装編と改造ミキシング編 とね、分けていこうかなと思った んですけど、今回はどんな改造をやって",
      "t": "难得有机会，所以想把视频分成纯涂装篇和改造混合篇，但这次想做什么改造呢？"
    },
    {
      "s": 30439,
      "d": 18401,
      "o": "いこうかなって言いますと、ミキシングと いうより、ま、ミキシングなんですけども 、キットになるべく手を加えないで追加 武装を加えてみるっていうのにはまって まして、今回はどんな感じの追加武装を 付け加えてみようかなということなんです",
      "t": "要说做什么，与其说是混合，不如说是混合，但我迷上了尽可能不加工套件而添加额外装备。这次想添加什么样的额外装备呢？"
    },
    {
      "s": 45120,
      "d": 35280,
      "o": "けども、今回はこちらのね、もう現在では ガンプラリバイク行くと棚の守護とね、 なっている棚の守護神って言ったらあれ ですけど、なんかずっと置いてがち、 置い手ありがちなヤーツ。この ティフォエウスガンダムキメラ。そいつに 付属のこちらの足についてるやつ。これ 名前な何て言うんですか?これ後で テロップ入れるのが面倒だからちゃんとね 、名前を調べてドラゴンドラゴンヘッドで すって。はい。2つのドラゴンヘッドをね 、使ってこれ追加装備作っていこうかなと 思ってるんですよね。これ見た目がさ、",
      "t": "这次是这个，现在去高达模型店的话，它就成了架子的守护神——提丰高达奇美拉。它附属的这个腿上的东西，叫什么名字来着？因为之后加字幕麻烦，我查了一下，是龙首。是的。我打算用这两个龙首来制作额外装备。"
    },
    {
      "s": 77600,
      "d": 16960,
      "o": "ティフォエスガンダムキメラ鉄血のキット も使った、ま、ミキシングガンプラって いう設定のあれですけど、いかにも いかつい龍ドラゴンの形をした悪魔感と いった感じのルックスがね、バルバタスと すごく合いそうですよね。一応これ",
      "t": "这个外观，使用了铁血系列的提丰高达奇美拉套件，是混合高达的设定，这种很有恶魔感的狰狞龙形外观，和巴巴托斯非常相配呢。"
    },
    {
      "s": 92200,
      "d": 16559,
      "o": "ティフイスガンダムケメラデタの昨年です かね。ニキシングのネタとしてね、一応 買ってみたんですけど、なかなか改造 ガンペラのネタにする機会に恵まれず、今 まであっためてたんですけど、今回 ようやく日の目をめれそうで良かったと",
      "t": "这个好像是去年的提丰高达奇美拉数据吧？作为混合的素材，姑且买了，但一直没有机会用作改造高达的题材，一直放着，这次终于能见光了，真是太好了。"
    },
    {
      "s": 107000,
      "d": 41959,
      "o": "いうことで、はい、今回どんな 感じにミキシングやっていこうかなという ことなんですけども、ま、2つついてるん で、とりあえず この顎的なやつ、これ外してもうてはい。 こんな感じだよ。両手につけたらいい感じ じゃねと思ったんで、これをなんとかね、 つけていけそうな感じするんでやってこう かなと思います。あとやっぱりね、私ね、 ギミック追加するの好きな人なんで、もう 癖でやっちゃう人なんで、もう病気なんで 、これなんとかね、これ肩につけても良さ そうじゃん。こんないかうん、生かしてる ね。肩につけたり、腕につけたりできる ようにしていけたらいいかなと思います。",
      "t": "是的，这次想怎么搞混合呢？反正有两个，先把这对颚部的零件拆下来。就像这样。我想装在双手上应该不错，感觉能装上，所以就试试。而且我这个人喜欢追加机关，已经成了习惯，简直是病。这个装在肩上也不错吧？这样活用它。如果能装到肩上或手腕上就好了。"
    },
    {
      "s": 147920,
      "d": 6360,
      "o": "はい。そんな感じです。 今回やっていくのはごつもり。",
      "t": "是的。就是这样。这次我打算这么做。"
    },
    {
      "s": 151280,
      "d": 34679,
      "o": "はい。え、それでは実際こいつをね、どうやって MG バルバトスルブスのワンブに取り付けていくかと言いますと、このワン部のアームガンを針を取り外してまって、こちらのドラゴンヘッドの工部に 4つ謎の黒。何使うかよく分からなの。 これにもサンリアナが2箇所開いています ので、ま、これを利用してランナーを中継 してアームガンのキブと はい、こんな風にこれで1箇所取り付ける",
      "t": "好的，那么具体怎么把它安装到MG巴巴托斯狼王的手臂上呢？首先把这个手臂上的枪拿掉，然后这个龙首上有四个谜一样的黑孔，不知道用什么。这里也有两个圆形凹陷，所以利用这个，用流道做连接件，像这样安装一个点。"
    },
    {
      "s": 183680,
      "d": 11880,
      "o": "固定箇所が1箇所できました。さすがに これではもうプランなのでもう1箇所固定 できる部分があればいいなって 思うんですけど、さっきはね、この",
      "t": "这样就有一个固定点了。但是这样还不够，要是能再有一个固定点就好了。"
    },
    {
      "s": 193000,
      "d": 37120,
      "o": "ドラゴンの口に当たる部分、これはもう やらないから外すって言いましたけど、 やっぱこれ使うことにします。口ではない らしいんですけど、元々こうなっててね、 180°回転したらなんかドラゴンの口 っぽくなって、まあいいなと思ったし、 これを利用した方がこの口ばの下顎に 当たる部分がハンドパーツに近い部分に 当たるようになったので、これを利用して なんとかこのねディテルを利用してへこん だ部分と合わせてクラバなりを返してこの 武器持ち手にねなんとか持たせられるよう にできればなって思います。これで2箇所",
      "t": "刚才我说这个像龙嘴的部分不弄了，但果然还是用上吧。虽然好像不是嘴，但原本是这样，旋转180度后就像龙嘴了，我觉得不错。用这个的话，这个下颚部分正好接近手掌零件，所以利用这个凹陷部分，配合细节，把夹子之类的东西翻过来，想办法让武器握持手能抓住。"
    },
    {
      "s": 228040,
      "d": 12749,
      "o": "固定できるんじゃないかなっていう木産 ですね。縦みたいに横にけることはできる かなって思います。じゃあね、やっていき ましょうかね。",
      "t": "这样应该能固定两个点了吧。我觉得或许能像纵向一样横向使用。那么，开始干吧。"
    },
    {
      "s": 240799,
      "d": 11841,
      "o": "はい、年も開けまして、現在1月4日 ようやくね、改造工が終わりました。 じゃあ、ま、早速見ていきましょうか。",
      "t": "好的，新年过了，现在是1月4日，改造终于完工了。那么，马上来看看吧。"
    },
    {
      "s": 249239,
      "d": 31960,
      "o": "まず肩に装着させる第1形態といった ところですかね。はい。こんな風に 見事ばっちりつくんですけども、こちら 元々穴が開いていたんですけど、こちらに ね、直径5mmのネオジウム磁石が ぴったり、ま、ちょっとちょっときつめで パーツの割り目がちょっと開いてしまっ てるんですけど、細かいこと気にしないで いきましょう。この肩のね、中の方にも",
      "t": "首先是安装在肩上的第一形态。是的。这样完美地装上了。这里本来有孔，我装上了直径5mm的钕磁铁，稍微有点紧，零件缝隙有点开，不过不要在意细节。"
    },
    {
      "s": 278800,
      "d": 11959,
      "o": "磁石仕込んであるんですけど、これで ぴったりつくようになりました。これだけ で十分いい感じですね。ミキシングが うまくはまったなって感じします。これ",
      "t": "肩膀内部也埋了磁铁，这样就完美贴合了。光这样就很有感觉了，混合得很成功。"
    },
    {
      "s": 288280,
      "d": 25680,
      "o": "だけでも十分いいんですけど、当初の予定 であった腕につけたいというコンセプトが あったんですけど、3mmのランナー軸を 返してアームガンの接続部パチパチッと いかんですけど、ま、一応全然 固定度合は緩くて、ま、補助的なものなん ですけども、さらにワン部の2箇所、ここ",
      "t": "光这样已经很好了，但当初计划是装到手腕上。用3mm流道轴改到枪的接口啪嗒啪嗒装上，不过固定度很松，只是辅助性的。"
    },
    {
      "s": 309919,
      "d": 44120,
      "o": "とこちらの部分に小型のネオジム磁石を 仕込みまして、こちらは映像があるので ご覧いただけれ分かるのですがはい、これ ちょっと見ていただいて はい、もう1個ね、こちらもこぶき屋の ジョイントパーツなんですけど、両端に 大将の寝ジ磁石をはめ込みまして、 埋め込んだ磁石同士をこれくっつけるとで 、ちょっとね、磁石同士の距離が近くなり ましたので、なんとかくっつくかなと。 こちらのドラゴンヘッドキブのパーツの中 にもネオジム磁石を仕込みまして、手首の 磁石と対応するような場所につけており まして、これでなんとか磁石でけるように",
      "t": "而且又在手臂的两个位置装了小型钕磁铁，这里有视频可以看，请看。还有一个，这也是某家的关节零件，两端嵌入了钕磁铁，将埋入的磁铁互相靠近，磁铁间的距离变近了，勉强能吸住。在龙首零件内部也装了钕磁铁，并安装在与手腕磁铁对应的位置。"
    },
    {
      "s": 351880,
      "d": 29360,
      "o": "もしたんですけど、ま、当初は磁石だけ でいけるかなっていう計画だったんです けど、このパーツですからね、重さがあり ますので、磁石だけでいけるやろうっての は無茶がありましたよね。ちょっと考えが 甘かったですね。行けるわけがない。考え てみたら本当に、ま、パーツの厚みを返し てるんで、実着し距離もありますし、ま、 磁力も、ま、この重さを支えるには耐え られないとさすがに。で、やっぱり当初の",
      "t": "虽然这样勉强用磁铁固定了，但最初计划只用磁铁，但因为这个零件有重量，仅靠磁铁是不现实的。想法太天真了。根本不可能。想想也是，因为零件有厚度，距离远，磁力支撑不了这个重量。"
    },
    {
      "s": 377840,
      "d": 47359,
      "o": "計画通りジャンクパーツとプラ板と ランナーの軸を組み合わせてこんな感じの ね、持ち手を作ってみましたのでで、 こんな感じでうん。はまるようになって いるとよいしょと。ほい。で、はい。ここ にもね、穴開けましたんで、プラ板で裏 から当て板をしてスピンモールドで3mm の穴を開けましたんで、 これを利用して持ってもらうと手でよ。 うん。これでようやくつくようになったん ですよね。後ろと磁石2点と持ち手の4点 でようやく持てるようになりました。はい",
      "t": "所以还是按照原计划，用废零件、塑料板和流道轴组合，做了一个这样的手柄。这样就能嵌入了。好。然后这里也打了孔，用塑料板从背面做衬板，再用旋转锉开了3mm的孔，这样就可以用手拿住了。嗯。这样终于能装上了。靠背后、两个磁铁点加手柄共四个点，终于能持握了。是的。"
    },
    {
      "s": 421639,
      "d": 115870,
      "o": "。最後仕上げに後ろから見たらね、軸が 剥き出しです。んで、これもジャンク パーツを加工したものなんですけど、これ をはめてもらってブラック裏ッカーも 隠せるようになりましたと。これで両方 はい、装着できましたと。いいね。壊れ ながらいい改造だ。はい、それでは続いて 追加装備の塗装をやっていきましょう。",
      "t": "最后收尾时从后面看，轴是裸露的。所以用废零件加工了这个，装上它就能隐藏黑色的背部了。这样两边都装好了。不错。虽然有点蹦，但改造不错。好的，那么接下来进行额外装备的涂装。"
    },
    {
      "s": 537519,
      "d": 320530,
      "o": "ヘ ສ あ 早い for こ 早いとエ 早い の",
      "t": "嘿，啊，快，for，这，快和诶，快的。"
    }
  ],
  "createdAt": 1783834306332
}